{
  "version": "1.0.0",
  "skill": "arc:e2e",
  "defaults": {
    "timeout": 300,
    "working_dir": "reports"
  },
  "evals": [
    {
      "id": "compile_then_gate_minimal_run",
      "title": "Compile report and pass strict gate",
      "description": "Tests that compile_report.py generates valid artifacts that pass check_artifacts.py --strict",
      "tags": ["ci", "compile", "gate"],
      "inputs": {
        "fixtures": [
          {
            "src": "simulate/evals/fixtures/minimal_run",
            "dest": "reports/minimal_run"
          }
        ]
      },
      "workflow": {
        "steps": [
          {
            "name": "compile_report",
            "run": "python3 scripts/compile_report.py --run-dir reports/minimal_run --table-backend native"
          }
        ]
      },
      "assertions": [
        {
          "type": "file_exists",
          "path": "reports/minimal_run/action-log.compiled.md"
        },
        {
          "type": "file_exists",
          "path": "reports/minimal_run/screenshot-manifest.compiled.md"
        },
        {
          "type": "markdown_tables_valid",
          "file": "reports/minimal_run/screenshot-manifest.compiled.md"
        },
        {
          "type": "file_contains",
          "path": "reports/minimal_run/action-log.compiled.md",
          "pattern": "## Action Log"
        },
        {
          "type": "run_validator",
          "command": "python3 scripts/check_artifacts.py --run-dir reports/minimal_run --strict",
          "expect_exit_code": 0
        }
      ]
    },
    {
      "id": "compile_non_strict_allows_bad_jsonl",
      "title": "Non-strict mode allows malformed JSONL",
      "description": "Tests that compile_report.py handles malformed JSONL in non-strict mode",
      "tags": ["compile", "non-strict"],
      "inputs": {
        "fixtures": [
          {
            "src": "simulate/evals/fixtures/bad_jsonl",
            "dest": "reports/bad_jsonl"
          }
        ]
      },
      "workflow": {
        "steps": [
          {
            "name": "compile_report",
            "run": "python3 scripts/compile_report.py --run-dir reports/bad_jsonl --table-backend native"
          }
        ]
      },
      "assertions": [
        {
          "type": "file_exists",
          "path": "reports/bad_jsonl/action-log.compiled.md"
        },
        {
          "type": "run_validator",
          "command": "python3 scripts/check_artifacts.py --run-dir reports/bad_jsonl",
          "expect_exit_code": 0
        },
        {
          "type": "run_validator",
          "command": "python3 scripts/check_artifacts.py --run-dir reports/bad_jsonl --strict",
          "expect_exit_code": 1
        }
      ]
    }
  ]
}
