{
  "version": "1.0.0",
  "skill": "arc-e2e",
  "defaults": {
    "timeout": 300,
    "working_dir": "reports"
  },
  "evals": [
    {
      "id": "compile_then_gate_minimal_run",
      "title": "Compile report and pass strict gate",
      "description": "Tests that compile_report.py generates valid artifacts that pass check_artifacts.py --strict",
      "tags": ["ci", "compile", "gate"],
      "inputs": {
        "fixtures": [
          {
            "src": "Arc/arc-e2e/evals/fixtures/minimal_run",
            "dest": "reports/minimal_run"
          }
        ]
      },
      "workflow": {
        "steps": [
          {
            "name": "compile_report",
            "run": "python3 scripts/compile_report.py --run-dir reports/minimal_run --table-backend native"
          }
        ]
      },
      "assertions": [
        {
          "type": "file_exists",
          "path": "reports/minimal_run/action-log.compiled.md"
        },
        {
          "type": "file_exists",
          "path": "reports/minimal_run/screenshot-manifest.compiled.md"
        },
        {
          "type": "markdown_tables_valid",
          "file": "reports/minimal_run/screenshot-manifest.compiled.md"
        },
        {
          "type": "file_contains",
          "path": "reports/minimal_run/action-log.compiled.md",
          "pattern": "# Action Log \\(Compiled\\)"
        },
        {
          "type": "run_validator",
          "command": "python3 scripts/check_artifacts.py --run-dir reports/minimal_run --strict",
          "expect_exit_code": 0
        }
      ]
    },
    {
      "id": "compile_non_strict_allows_bad_jsonl",
      "title": "Non-strict mode allows malformed JSONL",
      "description": "Tests that compile_report.py handles malformed JSONL in non-strict mode",
      "tags": ["compile", "non-strict"],
      "inputs": {
        "fixtures": [
          {
            "src": "Arc/arc-e2e/evals/fixtures/bad_jsonl",
            "dest": "reports/bad_jsonl"
          }
        ]
      },
      "workflow": {
        "steps": [
          {
            "name": "compile_report",
            "run": "python3 scripts/compile_report.py --run-dir reports/bad_jsonl --table-backend native"
          }
        ]
      },
      "assertions": [
        {
          "type": "file_exists",
          "path": "reports/bad_jsonl/action-log.compiled.md"
        },
        {
          "type": "run_validator",
          "command": "python3 scripts/check_artifacts.py --run-dir reports/bad_jsonl",
          "expect_exit_code": 0
        },
        {
          "type": "run_validator",
          "command": "python3 scripts/check_artifacts.py --run-dir reports/bad_jsonl --strict",
          "expect_exit_code": 1
        }
      ]
    },
    {
      "id": "visual_diff_identical_images",
      "title": "Visual diff PASS for identical screenshots",
      "description": "Verifies that visual_diff.py returns PASS (similarity=1.0) when comparing identical images",
      "tags": ["visual", "ci"],
      "inputs": {
        "fixtures": [
          {
            "src": "Arc/arc-e2e/evals/fixtures/visual_diff_run",
            "dest": "reports/visual_diff_run"
          }
        ]
      },
      "workflow": {
        "steps": [
          {
            "name": "visual_diff_identical",
            "run": "python3 scripts/visual_diff.py --baseline reports/visual_diff_run/baselines/s0001_login-page.png --current reports/visual_diff_run/screenshots/s0001_login-page.png --output reports/visual_diff_run/visual-diffs/s0001_login-page.diff.png --threshold 0.95 --json --fail-on-diff"
          }
        ]
      },
      "assertions": [
        {
          "type": "file_exists",
          "path": "reports/visual_diff_run/visual-diffs/s0001_login-page.diff.png"
        },
        {
          "type": "run_validator",
          "command": "python3 scripts/visual_diff.py --baseline reports/visual_diff_run/baselines/s0001_login-page.png --current reports/visual_diff_run/screenshots/s0001_login-page.png --threshold 0.95 --fail-on-diff",
          "expect_exit_code": 0
        }
      ]
    },
    {
      "id": "baseline_init_and_compare",
      "title": "Baseline init + compare + gate pipeline",
      "description": "Tests baseline_manager.py init from fixture run, then compare, then check_artifacts with --check-baselines",
      "tags": ["visual", "baseline", "ci"],
      "inputs": {
        "fixtures": [
          {
            "src": "Arc/arc-e2e/evals/fixtures/visual_diff_run",
            "dest": "reports/visual_diff_run"
          }
        ]
      },
      "workflow": {
        "steps": [
          {
            "name": "init_baselines",
            "run": "python3 scripts/baseline_manager.py init --run-dir reports/visual_diff_run --baseline-dir reports/visual_diff_run/baselines_test"
          },
          {
            "name": "compare_baselines",
            "run": "python3 scripts/baseline_manager.py compare --run-dir reports/visual_diff_run --baseline-dir reports/visual_diff_run/baselines_test --threshold 0.90 --output-dir reports/visual_diff_run/visual-diffs --fail-on-diff"
          },
          {
            "name": "compile_report",
            "run": "python3 scripts/compile_report.py --run-dir reports/visual_diff_run --table-backend native --in-place"
          },
          {
            "name": "check_gate",
            "run": "python3 scripts/check_artifacts.py --run-dir reports/visual_diff_run --check-baselines --strict"
          }
        ]
      },
      "assertions": [
        {
          "type": "file_exists",
          "path": "reports/visual_diff_run/baselines_test/baseline-manifest.json"
        },
        {
          "type": "file_exists",
          "path": "reports/visual_diff_run/visual-diffs/visual-diff-summary.json"
        },
        {
          "type": "run_validator",
          "command": "python3 scripts/check_artifacts.py --run-dir reports/visual_diff_run --check-baselines --strict",
          "expect_exit_code": 0
        }
      ]
    }
  ]
}
